{
  "schemaVersion": 1,
  "id": "typical-multichannel-v1",
  "evidenceKind": "Synthetic",
  "mode": "WallClockPaced",
  "sourceCount": 1,
  "channelsPerSource": 16,
  "numericType": "float32",
  "bytesPerSample": 4,
  "sampleRateHz": 2000,
  "blockSizeSamples": 100,
  "durationSeconds": 60,
  "expectedRawBytesPerSecond": 128000,
  "rawRecorder": {
    "queueCapacityBlocks": 64,
    "durability": "FlushOnFinalize"
  },
  "routerBranches": [
    {
      "id": "processing",
      "delivery": "Required",
      "capacityBlocks": 64,
      "overflow": "Wait"
    },
    {
      "id": "presentation",
      "delivery": "Optional",
      "capacityBlocks": 8,
      "overflow": "DropOldest"
    }
  ],
  "pipelineStages": [
    "dc-removal",
    "bandpass",
    "rms"
  ],
  "presentation": {
    "viewportSamples": 10000,
    "targetFps": 60
  },
  "faultSchedule": [
    {
      "target": "Presentation",
      "kind": "Delay",
      "atSequence": 100,
      "durationMs": 250
    }
  ]
}
